{
  "contract_version": "tracecanary/v2",
  "semantic_conventions_version": "opentelemetry/semconv/1.43.0",
  "canaries": [
    {"label": "synthetic-prompt", "category": "prompt", "value": "TCANARY_PROMPT_3f1c9a42"},
    {"label": "synthetic-tool-arguments", "category": "tool_arguments", "value": "TCANARY_TOOL_ARGUMENTS_8b27de10"},
    {"label": "synthetic-tool-result", "category": "tool_result", "value": "TCANARY_TOOL_RESULT_c4a05e77"},
    {"label": "synthetic-end-user-identifier", "category": "user_identifier", "value": "TCANARY_ENDUSER_ID_6d92b1f3"}
  ],
  "forbidden_attribute_keys": ["gen_ai.prompt", "gen_ai.tool.call.arguments", "gen_ai.tool.call.result"],
  "forbidden_attribute_key_prefixes": ["enduser."],
  "forbidden_path_prefixes": ["/resourceSpans/*/scopeSpans/*/spans/*/attributes/*/value/bytesValue"],
  "required_retained_fields": [
    {"scope": "resource", "key": "service.name"},
    {"scope": "span", "key": "gen_ai.operation.name"}
  ],
  "retention": {
    "version": "tracecanary.retention/v1",
    "requirements": [
      {
        "requirement_id": "service-name",
        "scope": "resource",
        "key": "service.name",
        "value_types": ["stringValue"],
        "minimum_count": 1,
        "comparison": "presence"
      },
      {
        "requirement_id": "operation-name",
        "scope": "span",
        "key": "gen_ai.operation.name",
        "value_types": ["stringValue"],
        "minimum_count": 1,
        "comparison": "presence"
      }
    ]
  },
  "limits": {"max_input_bytes": 5000000, "max_nesting": 100, "max_batch_files": 256}
}
